{
  "$schema": "https://pptx.dev/schema/opf-font-scheme/v1",
  "id": "noto-sans-georgian",
  "name": "Noto Sans Georgian",
  "app": "Google Slides",
  "languageFamily": "cs",
  "languages": [
    "Georgian"
  ],
  "major": "Noto Sans Georgian",
  "minor": "Noto Sans Georgian",
  "textSample": "ეს ულამაზესი სახლში",
  "type": "sans-serif"
}
