{
  "$schema": "https://pptx.dev/schema/opf-font-scheme/v1",
  "id": "noto-sans-tc",
  "name": "Noto Sans TC",
  "app": "Google Slides",
  "languageFamily": "ea",
  "languages": [
    "Chinese (traditional)"
  ],
  "major": "Noto Sans TC",
  "minor": "Noto Sans TC",
  "textSample": "這很美麗",
  "type": "sans-serif"
}
