{
  "$schema": "https://pptx.dev/schema/opf-font-scheme/v1",
  "id": "noto-sans-ethiopic",
  "name": "Noto Sans Ethiopic",
  "app": "Google Slides",
  "languageFamily": "cs",
  "languages": [
    "Amharic"
  ],
  "major": "Noto Sans Ethiopic",
  "minor": "Noto Sans Ethiopic",
  "textSample": "አማርኛ ቋንቋ እጅግ ጥሩ ነው።",
  "type": "sans-serif"
}
